{
"institute": "IPSL", 
"number": 1, 
"id": "96eba87b-2f6d-4eea-a474-3f5c9dff6675", 
"title": "Wrong pH computing", 
"description": "Oceans (PISCES) the hydrogen ion (H+) concentration instead of pH. pH variable has to be computed as follows: pH = -log10[H+].", 
"project": "CMIP5", 
"models": [
"IPSL-CM5A-LR"
], 
"severity": "High", 
"url": "http://errata.ipsl.upmc.fr/issue/2", 
"materials": [
"http://errata.ipsl.upmc.fr/static/images_errata/time.jpg", 
"http://errata.ipsl.upmc.fr/static/images_errata/time5.jpg"
], 
"workflow": "New", 
"created_at": "2016-05-25T09:12:31+00:00", 
"last_updated_at": "2016-05-25T09:12:31+00:00"
}